{
  "$schema": "http://json-schema.org/draft-07/schema#",
  "type": "object",
  "additionalProperties": false,
  "properties": {
    "schemaVersion": {
      "const": 1
    },
    "id": {
      "type": "string",
      "minLength": 1
    },
    "title": {
      "type": "string",
      "minLength": 1
    },
    "status": {
      "enum": [
        "in-progress",
        "complete"
      ]
    },
    "references": {
      "type": "array",
      "minItems": 1,
      "items": {
        "type": "string",
        "minLength": 1
      }
    },
    "units": {
      "type": "array",
      "minItems": 1,
      "items": {
        "type": "object",
        "additionalProperties": false,
        "properties": {
          "id": {
            "type": "string",
            "minLength": 1
          },
          "title": {
            "type": "string",
            "minLength": 1
          },
          "status": {
            "enum": [
              "in-progress",
              "complete"
            ]
          },
          "blocks": {
            "type": "array",
            "minItems": 1,
            "items": {
              "$ref": "#/$defs/block"
            }
          }
        },
        "required": [
          "id",
          "title",
          "status",
          "blocks"
        ]
      }
    }
  },
  "required": [
    "schemaVersion",
    "id",
    "title",
    "status",
    "references",
    "units"
  ],
  "$defs": {
    "block": {
      "oneOf": [
        {
          "type": "object",
          "additionalProperties": false,
          "properties": {
            "type": {
              "const": "heading"
            },
            "level": {
              "enum": [
                2,
                3,
                4
              ]
            },
            "text": {
              "type": "string",
              "minLength": 1
            }
          },
          "required": [
            "type",
            "level",
            "text"
          ]
        },
        {
          "type": "object",
          "additionalProperties": false,
          "properties": {
            "type": {
              "const": "paragraph"
            },
            "text": {
              "type": "string",
              "minLength": 1
            }
          },
          "required": [
            "type",
            "text"
          ]
        },
        {
          "type": "object",
          "additionalProperties": false,
          "properties": {
            "type": {
              "const": "math"
            },
            "notation": {
              "type": "string",
              "minLength": 1
            },
            "description": {
              "type": "string",
              "minLength": 1
            }
          },
          "required": [
            "type",
            "notation",
            "description"
          ]
        },
        {
          "type": "object",
          "additionalProperties": false,
          "properties": {
            "type": {
              "const": "definition"
            },
            "title": {
              "type": "string",
              "minLength": 1
            },
            "blocks": {
              "type": "array",
              "minItems": 1,
              "items": {
                "$ref": "#/$defs/block"
              }
            }
          },
          "required": [
            "type",
            "title",
            "blocks"
          ]
        },
        {
          "type": "object",
          "additionalProperties": false,
          "properties": {
            "type": {
              "const": "example"
            },
            "title": {
              "type": "string",
              "minLength": 1
            },
            "blocks": {
              "type": "array",
              "minItems": 1,
              "items": {
                "$ref": "#/$defs/block"
              }
            }
          },
          "required": [
            "type",
            "title",
            "blocks"
          ]
        },
        {
          "type": "object",
          "additionalProperties": false,
          "properties": {
            "type": {
              "const": "callout"
            },
            "title": {
              "type": "string",
              "minLength": 1
            },
            "blocks": {
              "type": "array",
              "minItems": 1,
              "items": {
                "$ref": "#/$defs/block"
              }
            }
          },
          "required": [
            "type",
            "title",
            "blocks"
          ]
        },
        {
          "type": "object",
          "additionalProperties": false,
          "properties": {
            "type": {
              "const": "table"
            },
            "headers": {
              "type": "array",
              "minItems": 1,
              "items": {
                "type": "string",
                "minLength": 1
              }
            },
            "rows": {
              "type": "array",
              "minItems": 1,
              "items": {
                "type": "array",
                "minItems": 1,
                "items": {
                  "type": "string",
                  "minLength": 1
                }
              }
            }
          },
          "required": [
            "type",
            "headers",
            "rows"
          ]
        },
        {
          "type": "object",
          "additionalProperties": false,
          "properties": {
            "type": {
              "const": "check"
            },
            "prompt": {
              "type": "string",
              "minLength": 1
            },
            "explanation": {
              "type": "array",
              "minItems": 1,
              "items": {
                "$ref": "#/$defs/block"
              }
            }
          },
          "required": [
            "type",
            "prompt",
            "explanation"
          ]
        }
      ]
    }
  }
}
