{
  "schemaVersion": 1,
  "id": "1.3",
  "title": "Propositional Equivalences",
  "status": "in-progress",
  "references": [
    "Kenneth H. Rosen, Discrete Mathematics and Its Applications, eighth edition, §1.3.1–§1.3.7, printed pages 26–37 (exposition).",
    "Original companion explanations, worked examples, and practice checks."
  ],
  "units": [
    {
      "id": "classifying",
      "title": "1. Ask whether a statement can ever change its truth value",
      "status": "in-progress",
      "blocks": [
        {
          "type": "callout",
          "title": "Start with the main idea",
          "blocks": [
            {
              "type": "paragraph",
              "text": "Two formulas can look different and still give the same answer in every situation. Section 1.3 teaches you how to recognize and justify those replacements. It then asks a different question: can a collection of logical conditions be true at all? Work through the examples before opening each check."
            }
          ]
        },
        {
          "type": "paragraph",
          "text": "Let p mean “The desk lamp is on.” The claim “The lamp is on or it is not on” is true whether p is T or F. The claim “The lamp is on and it is not on” is false either way. The simple claim “The lamp is on” changes truth value when p changes. We are talking about one lamp at one time, using the ordinary two-valued logic of this chapter."
        },
        {
          "type": "definition",
          "title": "Three kinds of truth-table columns",
          "blocks": [
            {
              "type": "paragraph",
              "text": "A tautology has T in every row. A contradiction has F in every row. A contingency has at least one T and at least one F. Classify the entire formula by all possible assignments to its variables, not by one situation you happen to observe."
            }
          ]
        },
        {
          "type": "table",
          "headers": [
            "p",
            "¬p",
            "p ∨ ¬p",
            "p ∧ ¬p"
          ],
          "rows": [
            [
              "T",
              "F",
              "T",
              "F"
            ],
            [
              "F",
              "T",
              "T",
              "F"
            ]
          ]
        },
        {
          "type": "paragraph",
          "text": "The third column never changes from T, so p ∨ ¬p is a tautology. The fourth never changes from F, so p ∧ ¬p is a contradiction. The p column itself contains both values, so p is a contingency. In formulas below, the constants T and F mean an always-true and an always-false expression."
        },
        {
          "type": "check",
          "prompt": "The formula p ∨ q is true when p = T and q = F. Does that make it a tautology?",
          "explanation": [
            {
              "type": "paragraph",
              "text": "No. One true row is not enough. Set p = F and q = F: then p ∨ q is F. Because it also has true rows, it is a contingency."
            }
          ]
        },
        {
          "type": "paragraph",
          "text": "Textbook connection: §1.3.1, printed pages 26–27."
        }
      ]
    },
    {
      "id": "equivalence",
      "title": "2. Equivalent means matching on every row",
      "status": "in-progress",
      "blocks": [
        {
          "type": "paragraph",
          "text": "Imagine a reminder that appears when a task is overdue, or when it is overdue and important. That second route adds nothing: anything overdue and important is already overdue. Let p mean overdue and q mean important. The two reminder conditions are p ∨ (p ∧ q) and p."
        },
        {
          "type": "definition",
          "title": "Logical equivalence",
          "blocks": [
            {
              "type": "paragraph",
              "text": "Formulas A and B are logically equivalent when they have the same truth value for every assignment to the variables involved. We write A ≡ B. Here A and B are names for whole formulas, which can contain several variables."
            }
          ]
        },
        {
          "type": "table",
          "headers": [
            "p",
            "q",
            "p ∧ q",
            "p ∨ (p ∧ q)"
          ],
          "rows": [
            [
              "T",
              "T",
              "T",
              "T"
            ],
            [
              "T",
              "F",
              "F",
              "T"
            ],
            [
              "F",
              "T",
              "F",
              "F"
            ],
            [
              "F",
              "F",
              "F",
              "F"
            ]
          ]
        },
        {
          "type": "paragraph",
          "text": "Compare the p column with the final column. They match in all four rows. Therefore p ∨ (p ∧ q) ≡ p. This particular equivalence is called absorption: the extra p ∧ q route is already covered by p."
        },
        {
          "type": "table",
          "headers": [
            "Notation",
            "What it says"
          ],
          "rows": [
            [
              "A ↔ B",
              "A formula. On a particular row it is true when A and B have the same truth value."
            ],
            [
              "A ≡ B",
              "A claim about formulas: their columns agree on every row. Equivalently, A ↔ B is a tautology."
            ]
          ]
        },
        {
          "type": "paragraph",
          "text": "In this book, ≡ is not another connective inside a truth-table formula. It announces an equivalence. Two formulas being false together on one row makes their biconditional true on that row; it does not establish equivalence."
        },
        {
          "type": "check",
          "prompt": "Are p → q and q → p equivalent just because both are true when p = q = T?",
          "explanation": [
            {
              "type": "paragraph",
              "text": "No. Take p = T and q = F. Then p → q is F, while q → p is T. A single mismatching row disproves equivalence. To prove equivalence by a truth table, you must check every row."
            }
          ]
        },
        {
          "type": "paragraph",
          "text": "Textbook connection: §1.3.2, printed pages 27–30."
        }
      ]
    },
    {
      "id": "laws",
      "title": "3. Use equivalence laws as permitted replacements",
      "status": "in-progress",
      "blocks": [
        {
          "type": "paragraph",
          "text": "An equivalence law is a reusable pattern. It tells you which expression can replace another without changing the result. Learn what each pattern does, rather than treating the names as a list to memorize. Each law can be used in either direction."
        },
        {
          "type": "table",
          "headers": [
            "Law",
            "Equivalent forms",
            "Meaning"
          ],
          "rows": [
            [
              "Identity",
              "p ∧ T ≡ p",
              "Requiring something guaranteed adds no restriction."
            ],
            [
              "Identity",
              "p ∨ F ≡ p",
              "An impossible alternative adds no possibility."
            ],
            [
              "Domination",
              "p ∨ T ≡ T",
              "A guaranteed alternative makes the OR true."
            ],
            [
              "Domination",
              "p ∧ F ≡ F",
              "An impossible requirement makes the AND false."
            ],
            [
              "Idempotent",
              "p ∨ p ≡ p",
              "Repeating an alternative does not change it."
            ],
            [
              "Idempotent",
              "p ∧ p ≡ p",
              "Repeating a requirement does not change it."
            ],
            [
              "Double negation",
              "¬(¬p) ≡ p",
              "Negating twice restores the original truth value."
            ],
            [
              "Negation",
              "p ∨ ¬p ≡ T",
              "One of a claim and its negation must be true."
            ],
            [
              "Negation",
              "p ∧ ¬p ≡ F",
              "They cannot both be true."
            ]
          ]
        },
        {
          "type": "table",
          "headers": [
            "Law",
            "Equivalent forms",
            "Meaning"
          ],
          "rows": [
            [
              "Commutative",
              "p ∨ q ≡ q ∨ p",
              "Swap the order of OR inputs."
            ],
            [
              "Commutative",
              "p ∧ q ≡ q ∧ p",
              "Swap the order of AND inputs."
            ],
            [
              "Associative",
              "(p ∨ q) ∨ r ≡ p ∨ (q ∨ r)",
              "Regroup a sequence of ORs."
            ],
            [
              "Associative",
              "(p ∧ q) ∧ r ≡ p ∧ (q ∧ r)",
              "Regroup a sequence of ANDs."
            ],
            [
              "Distributive",
              "p ∧ (q ∨ r) ≡ (p ∧ q) ∨ (p ∧ r)",
              "Require p with either alternative."
            ],
            [
              "Distributive",
              "p ∨ (q ∧ r) ≡ (p ∨ q) ∧ (p ∨ r)",
              "OR also distributes over AND in logic."
            ],
            [
              "Absorption",
              "p ∨ (p ∧ q) ≡ p",
              "The narrower alternative adds nothing."
            ],
            [
              "Absorption",
              "p ∧ (p ∨ q) ≡ p",
              "Once p holds, the second requirement adds nothing."
            ]
          ]
        },
        {
          "type": "example",
          "title": "Replace a whole subexpression",
          "blocks": [
            {
              "type": "paragraph",